1	0.000000000	192.168.119.133	192.168.119.1	TLSv1.2	38158,7890		91	Application Data
2	0.000167064	192.168.119.133	192.168.119.1	TLSv1.2	38164,7890		91	Application Data
3	0.000173428	192.168.119.133	192.168.119.1	TLSv1.2	38164,7890		76	Application Data
4	0.000081278	192.168.119.1	192.168.119.133	TCP	7890,38164		52	7890 → 38164 [ACK] Seq=1 Ack=64 Win=4100 Len=0 TSval=1119913437 TSecr=2865809275
5	0.000028221	192.168.119.133	192.168.119.1	TCP	38164,7890		52	38164 → 7890 [FIN, ACK] Seq=64 Ack=1 Win=501 Len=0 TSval=2865809276 TSecr=1119913437
6	0.000108886	192.168.119.1	192.168.119.133	TCP	7890,38164		52	7890 → 38164 [ACK] Seq=1 Ack=65 Win=4100 Len=0 TSval=1119913437 TSecr=2865809276
7	0.000438063	192.168.119.133	192.168.119.1	TLSv1.2	38158,7890		76	Application Data
8	0.000479885	192.168.119.1	192.168.119.133	TCP	7890,38164		52	7890 → 38164 [FIN, ACK] Seq=1 Ack=65 Win=4100 Len=0 TSval=1119913437 TSecr=2865809276
9	0.000000254	192.168.119.1	192.168.119.133	TCP	7890,38158		52	7890 → 38158 [ACK] Seq=1 Ack=64 Win=4100 Len=0 TSval=1119913438 TSecr=2865809275
10	0.000034308	192.168.119.133	192.168.119.1	TCP	38164,7890		52	38164 → 7890 [ACK] Seq=65 Ack=2 Win=501 Len=0 TSval=2865809277 TSecr=1119913437
11	0.000541333	192.168.119.133	192.168.119.1	TCP	38158,7890		52	38158 → 7890 [FIN, ACK] Seq=64 Ack=1 Win=501 Len=0 TSval=2865809277 TSecr=1119913438
12	0.000488499	192.168.119.1	192.168.119.133	TCP	7890,38158		52	7890 → 38158 [ACK] Seq=1 Ack=65 Win=4100 Len=0 TSval=1119913439 TSecr=2865809277
13	0.000721094	192.168.119.1	192.168.119.133	TCP	7890,38158		52	7890 → 38158 [FIN, ACK] Seq=1 Ack=65 Win=4100 Len=0 TSval=1119913439 TSecr=2865809277
14	0.000029242	192.168.119.133	192.168.119.1	TCP	38158,7890		52	38158 → 7890 [ACK] Seq=65 Ack=2 Win=501 Len=0 TSval=2865809278 TSecr=1119913439
15	2.220016852	192.168.119.1	192.168.119.133	TCP	7890,53900		41	7890 → 53900 [ACK] Seq=1 Ack=1 Win=4097 Len=1
16	0.000044038	192.168.119.133	192.168.119.1	TCP	53900,7890		64	53900 → 7890 [ACK] Seq=1 Ack=2 Win=501 Len=0 TSval=2865811498 TSecr=1119910737 SLE=1 SRE=2
17	0.290754565	192.168.119.133	192.168.119.1	TLSv1.2	40914,7890		81	Application Data
18	0.004347020	192.168.119.1	192.168.119.133	TLSv1.2	7890,40914		77	Application Data
19	0.000016939	192.168.119.133	192.168.119.1	TCP	40914,7890		52	40914 → 7890 [ACK] Seq=30 Ack=26 Win=501 Len=0 TSval=2865811794 TSecr=1119915950
20	0.279777000	192.168.119.1	192.168.119.133	TCP	7890,53876		41	7890 → 53876 [ACK] Seq=1 Ack=1 Win=4100 Len=1
21	0.000020456	192.168.119.133	192.168.119.1	TCP	53876,7890		64	53876 → 7890 [ACK] Seq=1 Ack=2 Win=501 Len=0 TSval=2865812073 TSecr=1119911248 SLE=1 SRE=2
22	0.890826401	192.168.119.1	239.255.255.250	SSDP		51733,1900	203	M-SEARCH * HTTP/1.1 
23	0.549130069	192.168.119.133	192.168.119.1	TLSv1.2	44316,7890		581	Application Data
24	0.000200798	192.168.119.133	192.168.119.1	TLSv1.2	44316,7890		160	Application Data
25	0.000085795	192.168.119.1	192.168.119.133	TCP	7890,44316		52	7890 → 44316 [ACK] Seq=1 Ack=638 Win=4098 Len=0 TSval=1119917666 TSecr=2865813513
26	0.216426149	192.168.119.1	192.168.119.133	TLSv1.2	7890,44316		963	Application Data
27	0.000000259	192.168.119.1	192.168.119.133	TLSv1.2	7890,44316		83	Application Data
28	0.000023471	192.168.119.133	192.168.119.1	TCP	44316,7890		52	44316 → 7890 [ACK] Seq=638 Ack=912 Win=1309 Len=0 TSval=2865813730 TSecr=1119917882
29	0.000037669	192.168.119.133	192.168.119.1	TCP	44316,7890		52	44316 → 7890 [ACK] Seq=638 Ack=943 Win=1309 Len=0 TSval=2865813730 TSecr=1119917882
30	0.015658123	192.168.119.133	192.168.119.1	TCP	42890,7890		60	42890 → 7890 [SYN] Seq=0 Win=64240 Len=0 MSS=1460 SACK_PERM=1 TSval=2865813746 TSecr=0 WS=128
31	0.000185899	192.168.119.1	192.168.119.133	TCP	7890,42890		60	7890 → 42890 [SYN, ACK] Seq=0 Ack=1 Win=65535 Len=0 MSS=1460 WS=256 SACK_PERM=1 TSval=1119917898 TSecr=2865813746
32	0.000026781	192.168.119.133	192.168.119.1	TCP	42890,7890		52	42890 → 7890 [ACK] Seq=1 Ack=1 Win=64256 Len=0 TSval=2865813746 TSecr=1119917898
33	0.000202344	192.168.119.133	192.168.119.1	HTTP	42890,7890		281	CONNECT lf3-drive.feishucdn.com:443 HTTP/1.1 
34	0.000165158	192.168.119.1	192.168.119.133	HTTP	7890,42890		91	HTTP/1.1 200 Connection established 
35	0.000007444	192.168.119.133	192.168.119.1	TCP	42890,7890		52	42890 → 7890 [ACK] Seq=230 Ack=40 Win=64256 Len=0 TSval=2865813746 TSecr=1119917898
36	0.001199714	192.168.119.133	192.168.119.1	TLSv1	42890,7890		569	Client Hello
37	0.020343820	192.168.119.1	192.168.119.133	TLSv1.2	7890,42890		3905	Server Hello, Certificate, Server Key Exchange, Server Hello Done
38	0.000073921	192.168.119.133	192.168.119.1	TCP	42890,7890		52	42890 → 7890 [ACK] Seq=747 Ack=3893 Win=62592 Len=0 TSval=2865813768 TSecr=1119917919
39	0.000685586	192.168.119.133	192.168.119.1	TLSv1.2	42890,7890		145	Client Key Exchange, Change Cipher Spec, Encrypted Handshake Message
40	0.002883300	192.168.119.1	192.168.119.133	TLSv1.2	7890,42890		326	New Session Ticket, Change Cipher Spec, Encrypted Handshake Message
41	0.000000097	192.168.119.1	192.168.119.133	TLSv1.2	7890,42890		121	Application Data
42	0.000162417	192.168.119.133	192.168.119.1	TCP	42890,7890		52	42890 → 7890 [ACK] Seq=840 Ack=4236 Win=64128 Len=0 TSval=2865813772 TSecr=1119917923
43	0.000179051	192.168.119.133	192.168.119.1	TLSv1.2	42890,7890		229	Application Data
44	0.000094245	192.168.119.133	192.168.119.1	TLSv1.2	42890,7890		386	Application Data
45	0.000079531	192.168.119.1	192.168.119.133	TCP	7890,42890		52	7890 → 42890 [ACK] Seq=4236 Ack=1351 Win=1048320 Len=0 TSval=1119917924 TSecr=2865813772
46	0.000169902	192.168.119.133	192.168.119.1	TLSv1.2	42890,7890		90	Application Data
47	0.003104136	192.168.119.1	192.168.119.133	TLSv1.2	7890,42890		90	Application Data
48	0.011387058	192.168.119.1	192.168.119.133	TLSv1.2	7890,42890		17428	Application Data
49	0.000037345	192.168.119.133	192.168.119.1	TCP	42890,7890		52	42890 → 7890 [ACK] Seq=1389 Ack=21650 Win=53888 Len=0 TSval=2865813787 TSecr=1119917927
50	0.000100771	192.168.119.1	192.168.119.133	TLSv1.2	7890,42890		15980	Application Data [TCP segment of a reassembled PDU]
51	0.000014581	192.168.119.1	192.168.119.133	TCP	7890,42890		3248	7890 → 42890 [PSH, ACK] Seq=37578 Ack=1389 Win=1048320 Len=3196 TSval=1119917938 TSecr=2865813787 [TCP segment of a reassembled PDU]
52	0.000033488	192.168.119.133	192.168.119.1	TCP	42890,7890		52	42890 → 7890 [ACK] Seq=1389 Ack=40774 Win=64128 Len=0 TSval=2865813787 TSecr=1119917938
53	0.002084080	192.168.119.1	192.168.119.133	TLSv1.2	7890,42890		32820	Application Data, Application Data, Application Data
54	0.000007464	192.168.119.133	192.168.119.1	TCP	42890,7890		52	42890 → 7890 [ACK] Seq=1389 Ack=73542 Win=100096 Len=0 TSval=2865813789 TSecr=1119917940
55	0.000038703	192.168.119.1	192.168.119.133	TCP	7890,42890		2324	7890 → 42890 [PSH, ACK] Seq=73542 Ack=1389 Win=1048320 Len=2272 TSval=1119917940 TSecr=2865813787 [TCP segment of a reassembled PDU]
56	0.000069294	192.168.119.133	192.168.119.1	TCP	42890,7890		52	42890 → 7890 [ACK] Seq=1389 Ack=75814 Win=98048 Len=0 TSval=2865813789 TSecr=1119917940
57	0.002093950	192.168.119.1	192.168.119.133	TLSv1.2	7890,42890		32820	Application Data, Application Data, Application Data
58	0.000006840	192.168.119.133	192.168.119.1	TCP	42890,7890		52	42890 → 7890 [ACK] Seq=1389 Ack=108582 Win=100096 Len=0 TSval=2865813791 TSecr=1119917943
59	0.000043954	192.168.119.1	192.168.119.133	TCP	7890,42890		2324	7890 → 42890 [PSH, ACK] Seq=108582 Ack=1389 Win=1048320 Len=2272 TSval=1119917943 TSecr=2865813789 [TCP segment of a reassembled PDU]
60	0.000066429	192.168.119.133	192.168.119.1	TCP	42890,7890		52	42890 → 7890 [ACK] Seq=1389 Ack=110854 Win=98048 Len=0 TSval=2865813791 TSecr=1119917943
61	0.002216012	192.168.119.1	192.168.119.133	TLSv1.2	7890,42890		32820	Application Data, Application Data, Application Data
62	0.000006810	192.168.119.133	192.168.119.1	TCP	42890,7890		52	42890 → 7890 [ACK] Seq=1389 Ack=143622 Win=100096 Len=0 TSval=2865813794 TSecr=1119917945
63	0.000040479	192.168.119.1	192.168.119.133	TCP	7890,42890		8164	7890 → 42890 [PSH, ACK] Seq=143622 Ack=1389 Win=1048320 Len=8112 TSval=1119917945 TSecr=2865813791 [TCP segment of a reassembled PDU]
64	0.000067588	192.168.119.133	192.168.119.1	TCP	42890,7890		52	42890 → 7890 [ACK] Seq=1389 Ack=151734 Win=100096 Len=0 TSval=2865813794 TSecr=1119917945
65	0.002091916	192.168.119.1	192.168.119.133	TLSv1.2	7890,42890		32820	Application Data, Application Data, Application Data
66	0.000007420	192.168.119.133	192.168.119.1	TCP	42890,7890		52	42890 → 7890 [ACK] Seq=1389 Ack=184502 Win=165632 Len=0 TSval=2865813796 TSecr=1119917947
67	0.000042342	192.168.119.1	192.168.119.133	TLSv1.2	7890,42890		8164	Application Data [TCP segment of a reassembled PDU]
68	0.000003914	192.168.119.133	192.168.119.1	TCP	42890,7890		52	42890 → 7890 [ACK] Seq=1389 Ack=192614 Win=181888 Len=0 TSval=2865813796 TSecr=1119917947
69	0.002831168	192.168.119.1	192.168.119.133	TLSv1.2	7890,42890		32820	Application Data, Application Data, Application Data
70	0.000007998	192.168.119.133	192.168.119.1	TCP	42890,7890		52	42890 → 7890 [ACK] Seq=1389 Ack=225382 Win=247424 Len=0 TSval=2865813799 TSecr=1119917950
71	0.000047944	192.168.119.1	192.168.119.133	TLSv1.2	7890,42890		14004	Application Data, Application Data
72	0.000005516	192.168.119.133	192.168.119.1	TCP	42890,7890		52	42890 → 7890 [ACK] Seq=1389 Ack=239334 Win=275328 Len=0 TSval=2865813799 TSecr=1119917950
73	0.001399175	192.168.119.1	192.168.119.133	TLSv1.2	7890,42890		22725	Application Data, Application Data, Application Data
74	0.000023268	192.168.119.133	192.168.119.1	TCP	42890,7890		52	42890 → 7890 [ACK] Seq=1389 Ack=262007 Win=320640 Len=0 TSval=2865813800 TSecr=1119917951
75	0.168675899	192.168.119.1	239.255.255.250	SSDP		51733,1900	203	M-SEARCH * HTTP/1.1 
76	0.436593671	192.168.119.1	192.168.119.133	TCP	7890,33066		52	7890 → 33066 [FIN, ACK] Seq=1 Ack=1 Win=4099 Len=0 TSval=1119918555 TSecr=2865799385
77	0.000306813	192.168.119.133	192.168.119.1	TLSv1.2	33066,7890		91	Application Data
78	0.000473832	192.168.119.1	192.168.119.133	TCP	7890,33066		40	7890 → 33066 [RST, ACK] Seq=2 Ack=40 Win=0 Len=0
79	0.574483165	192.168.119.1	239.255.255.250	SSDP		51733,1900	203	M-SEARCH * HTTP/1.1 
80	0.669841662	192.168.119.133	192.168.119.1	AMS	48898,7890		81	
81	0.004090857	192.168.119.1	192.168.119.133	AMS	7890,48898		77	
82	0.000017157	192.168.119.133	192.168.119.1	TCP	48898,7890		52	48898 → 7890 [ACK] Seq=30 Ack=26 Win=501 Len=0 TSval=2865815655 TSecr=1119919802
83	0.343062420	192.168.119.1	239.255.255.250	SSDP		51733,1900	203	M-SEARCH * HTTP/1.1 
84	1.595110185	192.168.119.133	192.168.119.1	TLSv1.2	44316,7890		2058	Application Data
85	0.000167930	192.168.119.1	192.168.119.133	TCP	7890,44316		52	7890 → 44316 [ACK] Seq=943 Ack=2644 Win=4100 Len=0 TSval=1119921735 TSecr=2865817593
86	0.000049419	192.168.119.133	192.168.119.1	TLSv1.2	44316,7890		254	Application Data
87	0.032766368	192.168.119.1	192.168.119.133	TLSv1.2	7890,44316		931	Application Data
88	0.000000208	192.168.119.1	192.168.119.133	TLSv1.2	7890,44316		83	Application Data
89	0.000035598	192.168.119.133	192.168.119.1	TCP	44316,7890		52	44316 → 7890 [ACK] Seq=2846 Ack=1822 Win=1309 Len=0 TSval=2865817626 TSecr=1119921768
90	0.000051452	192.168.119.133	192.168.119.1	TCP	44316,7890		52	44316 → 7890 [ACK] Seq=2846 Ack=1853 Win=1309 Len=0 TSval=2865817626 TSecr=1119921768
91	0.552771967	192.168.119.1	192.168.119.133	TCP	7890,40824		41	7890 → 40824 [ACK] Seq=1 Ack=1 Win=4100 Len=1
92	0.000018758	192.168.119.133	192.168.119.1	TCP	40824,7890		64	40824 → 7890 [ACK] Seq=1 Ack=2 Win=2877 Len=0 TSval=2865818179 TSecr=1119907304 SLE=1 SRE=2
93	0.172759805	192.168.119.1	192.168.119.133	TCP	7890,36420		41	7890 → 36420 [ACK] Seq=1 Ack=1 Win=4100 Len=1
94	0.000045761	192.168.119.133	192.168.119.1	TCP	36420,7890		64	36420 → 7890 [ACK] Seq=1 Ack=2 Win=501 Len=0 TSval=2865818351 TSecr=1119712412 SLE=1 SRE=2
95	1.706131031	192.168.119.1	192.168.119.133	TCP	7890,33076		41	7890 → 33076 [ACK] Seq=1 Ack=1 Win=4100 Len=1
96	0.000039886	192.168.119.133	192.168.119.1	TCP	33076,7890		64	33076 → 7890 [ACK] Seq=1 Ack=2 Win=501 Len=0 TSval=2865820058 TSecr=1119894218 SLE=1 SRE=2
97	1.006029475	192.168.119.133	185.125.190.57	NTP		50182,123	76	NTP Version 4, client
98	0.280848627	185.125.190.57	192.168.119.133	NTP		123,50182	76	NTP Version 4, server
99	0.329862715	192.168.119.133	192.168.119.1	TCP	53900,7890		52	[TCP Keep-Alive] 53900 → 7890 [ACK] Seq=0 Ack=2 Win=501 Len=0 TSval=2865821674 TSecr=1119910737
100	0.000190366	192.168.119.1	192.168.119.133	TCP	7890,53900		52	[TCP Keep-Alive ACK] 7890 → 53900 [ACK] Seq=2 Ack=1 Win=4097 Len=0 TSval=1119925807 TSecr=2865811498
101	0.511773858	192.168.119.133	192.168.119.1	TCP	53876,7890		52	[TCP Keep-Alive] 53876 → 7890 [ACK] Seq=0 Ack=2 Win=501 Len=0 TSval=2865822186 TSecr=1119911248
102	0.000179456	192.168.119.1	192.168.119.133	TCP	7890,53876		52	[TCP Keep-Alive ACK] 7890 → 53876 [ACK] Seq=2 Ack=1 Win=4100 Len=0 TSval=1119926319 TSecr=2865812073
103	0.285875979	192.168.119.1	192.168.119.133	TCP	7890,48036		41	7890 → 48036 [ACK] Seq=1 Ack=1 Win=4100 Len=1
104	0.000000274	192.168.119.1	192.168.119.133	TCP	7890,48044		41	7890 → 48044 [ACK] Seq=1 Ack=1 Win=4097 Len=1
105	0.000020301	192.168.119.133	192.168.119.1	TCP	48036,7890		64	48036 → 7890 [ACK] Seq=1 Ack=2 Win=501 Len=0 TSval=2865822472 TSecr=1119881590 SLE=1 SRE=2
106	0.000049140	192.168.119.133	192.168.119.1	TCP	48044,7890		64	48044 → 7890 [ACK] Seq=1 Ack=2 Win=501 Len=0 TSval=2865822472 TSecr=1119881591 SLE=1 SRE=2
107	1.371372743	192.168.119.133	192.168.119.1	TLSv1.2	40824,7890		133	Application Data
108	0.017627112	192.168.119.1	192.168.119.133	TLSv1.2	7890,40824		363	Application Data
109	0.000020794	192.168.119.133	192.168.119.1	TCP	40824,7890		52	40824 → 7890 [ACK] Seq=82 Ack=313 Win=2899 Len=0 TSval=2865823861 TSecr=1119928007
110	0.000705647	192.168.119.133	192.168.119.1	TLSv1.2	40824,7890		185	Application Data
111	0.000078919	192.168.119.133	192.168.119.1	TLSv1.2	40824,7890		1671	Application Data
112	0.000101975	192.168.119.133	192.168.119.1	TLSv1.2	40824,7890		2959	Application Data
113	0.000000800	192.168.119.1	192.168.119.133	TCP	7890,40824		52	7890 → 40824 [ACK] Seq=313 Ack=1663 Win=4100 Len=0 TSval=1119928008 TSecr=2865823862
114	0.000090428	192.168.119.1	192.168.119.133	TCP	7890,40824		52	7890 → 40824 [ACK] Seq=313 Ack=3282 Win=4100 Len=0 TSval=1119928008 TSecr=2865823862
115	0.000000042	192.168.119.1	192.168.119.133	TCP	7890,40824		52	7890 → 40824 [ACK] Seq=313 Ack=4741 Win=4100 Len=0 TSval=1119928008 TSecr=2865823862
116	0.067296323	192.168.119.1	192.168.119.133	TLSv1.2	7890,40824		490	Application Data
117	0.000000235	192.168.119.1	192.168.119.133	TLSv1.2	7890,40824		90	Application Data
118	0.000188660	192.168.119.133	192.168.119.1	TCP	40824,7890		52	40824 → 7890 [ACK] Seq=4741 Ack=789 Win=2922 Len=0 TSval=2865823930 TSecr=1119928075
119	2.211107987	192.168.119.133	192.168.119.1	TLSv1.2	44316,7890		2577	Application Data
120	0.000204509	192.168.119.1	192.168.119.133	TCP	7890,44316		52	7890 → 44316 [ACK] Seq=1853 Ack=5371 Win=4100 Len=0 TSval=1119930299 TSecr=2865826141
121	0.000012121	192.168.119.133	192.168.119.1	TLSv1.2	44316,7890		204	Application Data
122	0.038301739	192.168.119.1	192.168.119.133	TLSv1.2	7890,44316		830	Application Data
123	0.000000198	192.168.119.1	192.168.119.133	TLSv1.2	7890,44316		83	Application Data
124	0.000038619	192.168.119.133	192.168.119.1	TCP	44316,7890		52	44316 → 7890 [ACK] Seq=5523 Ack=2631 Win=1309 Len=0 TSval=2865826180 TSecr=1119930337
125	0.000149316	192.168.119.133	192.168.119.1	TCP	44316,7890		52	44316 → 7890 [ACK] Seq=5523 Ack=2662 Win=1309 Len=0 TSval=2865826180 TSecr=1119930337
126	0.328972356	192.168.119.1	192.168.119.133	TCP	7890,53900		41	[TCP Keep-Alive] 7890 → 53900 [ACK] Seq=1 Ack=1 Win=4097 Len=1
127	0.000048001	192.168.119.133	192.168.119.1	TCP	53900,7890		64	[TCP Keep-Alive ACK] 53900 → 7890 [ACK] Seq=1 Ack=2 Win=501 Len=0 TSval=2865826509 TSecr=1119925807 SLE=1 SRE=2
128	0.281771079	192.168.119.133	192.168.119.1	TLSv1.2	40914,7890		81	Application Data
129	0.004199732	192.168.119.1	192.168.119.133	TLSv1.2	7890,40914		77	Application Data
130	0.000013255	192.168.119.133	192.168.119.1	TCP	40914,7890		52	40914 → 7890 [ACK] Seq=59 Ack=51 Win=501 Len=0 TSval=2865826795 TSecr=1119930955
131	0.274352320	192.168.119.1	192.168.119.133	TCP	7890,53876		41	[TCP Keep-Alive] 7890 → 53876 [ACK] Seq=1 Ack=1 Win=4100 Len=1
132	0.000048461	192.168.119.133	192.168.119.1	TCP	53876,7890		64	[TCP Keep-Alive ACK] 53876 → 7890 [ACK] Seq=1 Ack=2 Win=501 Len=0 TSval=2865827069 TSecr=1119926319 SLE=1 SRE=2
133	1.729873954	192.168.119.1	192.168.119.133	TCP	7890,42890		41	[TCP Keep-Alive] 7890 → 42890 [ACK] Seq=262006 Ack=1389 Win=1048320 Len=1
134	0.000017213	192.168.119.133	192.168.119.1	TCP	42890,7890		64	[TCP Keep-Alive ACK] 42890 → 7890 [ACK] Seq=1389 Ack=262007 Win=320640 Len=0 TSval=2865828799 TSecr=1119917951 SLE=262006 SRE=262007
135	0.961869533	192.168.119.133	192.168.119.1	TLSv1.2	44316,7890		2306	Application Data
136	0.000239852	192.168.119.1	192.168.119.133	TCP	7890,44316		52	7890 → 44316 [ACK] Seq=2662 Ack=7777 Win=4100 Len=0 TSval=1119933929 TSecr=2865829761
137	0.000019904	192.168.119.133	192.168.119.1	TLSv1.2	44316,7890		351	Application Data
138	0.033693284	192.168.119.1	192.168.119.133	TLSv1.2	7890,44316		687	Application Data
139	0.000000055	192.168.119.1	192.168.119.133	TLSv1.2	7890,44316		83	Application Data
140	0.000028910	192.168.119.133	192.168.119.1	TCP	44316,7890		52	44316 → 7890 [ACK] Seq=8076 Ack=3297 Win=1309 Len=0 TSval=2865829795 TSecr=1119933962
141	0.000041695	192.168.119.133	192.168.119.1	TCP	44316,7890		52	44316 → 7890 [ACK] Seq=8076 Ack=3328 Win=1309 Len=0 TSval=2865829795 TSecr=1119933962
142	0.850036084	192.168.119.1	192.168.119.133	TCP	7890,48898		41	[TCP Keep-Alive] 7890 → 48898 [ACK] Seq=25 Ack=30 Win=4100 Len=1
143	0.000025986	192.168.119.133	192.168.119.1	TCP	48898,7890		64	[TCP Keep-Alive ACK] 48898 → 7890 [ACK] Seq=30 Ack=26 Win=501 Len=0 TSval=2865830645 TSecr=1119919802 SLE=25 SRE=26
144	0.007400560	192.168.119.133	192.168.119.1	AMS	48898,7890		81	
145	0.003670209	192.168.119.1	192.168.119.133	AMS	7890,48898		77	
146	0.000016421	192.168.119.133	192.168.119.1	TCP	48898,7890		52	48898 → 7890 [ACK] Seq=59 Ack=51 Win=501 Len=0 TSval=2865830656 TSecr=1119934825
147	0.619694372	192.168.119.133	192.168.119.1	TLSv1.2	48044,7890		91	Application Data
148	0.000102910	192.168.119.133	192.168.119.1	TLSv1.2	48036,7890		91	Application Data
149	0.000151437	192.168.119.133	192.168.119.1	TLSv1.2	48044,7890		76	Application Data
150	0.000061057	192.168.119.133	192.168.119.1	TCP	48044,7890		52	48044 → 7890 [FIN, ACK] Seq=64 Ack=2 Win=501 Len=0 TSval=2865831276 TSecr=1119881591
151	0.000081598	192.168.119.1	192.168.119.133	TCP	7890,48044		52	7890 → 48044 [ACK] Seq=2 Ack=64 Win=4097 Len=0 TSval=1119935445 TSecr=2865831276
152	0.000000090	192.168.119.1	192.168.119.133	TCP	7890,48044		52	7890 → 48044 [ACK] Seq=2 Ack=65 Win=4097 Len=0 TSval=1119935445 TSecr=2865831276
153	0.000179393	192.168.119.1	192.168.119.133	TCP	7890,48044		52	7890 → 48044 [FIN, ACK] Seq=2 Ack=65 Win=4097 Len=0 TSval=1119935446 TSecr=2865831276
154	0.000009115	192.168.119.133	192.168.119.1	TCP	48044,7890		52	48044 → 7890 [ACK] Seq=65 Ack=3 Win=501 Len=0 TSval=2865831276 TSecr=1119935446
155	0.000046379	192.168.119.133	192.168.119.1	TLSv1.2	48036,7890		76	Application Data
156	0.000001360	192.168.119.133	192.168.119.1	TCP	48036,7890		52	48036 → 7890 [FIN, ACK] Seq=64 Ack=2 Win=501 Len=0 TSval=2865831276 TSecr=1119881590
157	0.000110447	192.168.119.1	192.168.119.133	TCP	7890,48036		52	7890 → 48036 [ACK] Seq=2 Ack=64 Win=4100 Len=0 TSval=1119935446 TSecr=2865831276
158	0.000000050	192.168.119.1	192.168.119.133	TCP	7890,48036		52	7890 → 48036 [ACK] Seq=2 Ack=65 Win=4100 Len=0 TSval=1119935446 TSecr=2865831276
159	0.000174965	192.168.119.1	192.168.119.133	TCP	7890,48036		52	7890 → 48036 [FIN, ACK] Seq=2 Ack=65 Win=4100 Len=0 TSval=1119935446 TSecr=2865831276
160	0.000005855	192.168.119.133	192.168.119.1	TCP	48036,7890		52	48036 → 7890 [ACK] Seq=65 Ack=3 Win=501 Len=0 TSval=2865831277 TSecr=1119935446
161	1.731540654	192.168.119.133	192.168.119.1	TLSv1.2	40824,7890		131	Application Data
162	0.048038525	192.168.119.1	192.168.119.133	TCP	7890,40824		52	7890 → 40824 [ACK] Seq=789 Ack=4820 Win=4100 Len=0 TSval=1119937226 TSecr=2865833008
163	0.034669299	192.168.119.1	192.168.119.133	TLSv1.2	7890,40824		367	Application Data
164	0.000749501	192.168.119.133	192.168.119.1	TLSv1.2	40824,7890		137	Application Data
165	0.000079345	192.168.119.133	192.168.119.1	TLSv1.2	40824,7890		1670	Application Data
166	0.000119811	192.168.119.133	192.168.119.1	TCP	40824,7890		7292	[TCP segment of a reassembled PDU]
167	0.000006800	192.168.119.1	192.168.119.133	TCP	7890,40824		52	7890 → 40824 [ACK] Seq=1104 Ack=6353 Win=4100 Len=0 TSval=1119937262 TSecr=2865833092
168	0.000115162	192.168.119.1	192.168.119.133	TCP	7890,40824		52	7890 → 40824 [ACK] Seq=1104 Ack=7971 Win=4100 Len=0 TSval=1119937262 TSecr=2865833092
169	0.000000031	192.168.119.1	192.168.119.133	TCP	7890,40824		52	7890 → 40824 [ACK] Seq=1104 Ack=10867 Win=4100 Len=0 TSval=1119937262 TSecr=2865833092
170	0.000000015	192.168.119.1	192.168.119.133	TCP	7890,40824		52	7890 → 40824 [ACK] Seq=1104 Ack=13763 Win=4100 Len=0 TSval=1119937262 TSecr=2865833092
171	0.000011267	192.168.119.133	192.168.119.1	TCP	40824,7890		2948	40824 → 7890 [PSH, ACK] Seq=13763 Ack=1104 Win=2945 Len=2896 TSval=2865833092 TSecr=1119937262 [TCP segment of a reassembled PDU]
172	0.000077733	192.168.119.133	192.168.119.1	TLSv1.2	40824,7890		10188	Application Data [TCP segment of a reassembled PDU]
173	0.000134035	192.168.119.1	192.168.119.133	TCP	7890,40824		52	7890 → 40824 [ACK] Seq=1104 Ack=16659 Win=4100 Len=0 TSval=1119937262 TSecr=2865833092
174	0.000000062	192.168.119.1	192.168.119.133	TCP	7890,40824		52	7890 → 40824 [ACK] Seq=1104 Ack=19555 Win=4100 Len=0 TSval=1119937262 TSecr=2865833092
175	0.000000014	192.168.119.1	192.168.119.133	TCP	7890,40824		52	7890 → 40824 [ACK] Seq=1104 Ack=22451 Win=4100 Len=0 TSval=1119937262 TSecr=2865833092
176	0.000000017	192.168.119.1	192.168.119.133	TCP	7890,40824		52	7890 → 40824 [ACK] Seq=1104 Ack=25347 Win=4100 Len=0 TSval=1119937262 TSecr=2865833092
177	0.000005213	192.168.119.133	192.168.119.1	TCP	40824,7890		1500	40824 → 7890 [ACK] Seq=26795 Ack=1104 Win=2945 Len=1448 TSval=2865833092 TSecr=1119937262 [TCP segment of a reassembled PDU]
178	0.000033004	192.168.119.133	192.168.119.1	TLSv1.2	40824,7890		8573	Application Data
179	0.000155687	192.168.119.1	192.168.119.133	TCP	7890,40824		52	7890 → 40824 [ACK] Seq=1104 Ack=28243 Win=4100 Len=0 TSval=1119937262 TSecr=2865833092
180	0.000000071	192.168.119.1	192.168.119.133	TCP	7890,40824		52	7890 → 40824 [ACK] Seq=1104 Ack=31139 Win=4100 Len=0 TSval=1119937262 TSecr=2865833092
181	0.000000019	192.168.119.1	192.168.119.133	TCP	7890,40824		52	7890 → 40824 [ACK] Seq=1104 Ack=34035 Win=4100 Len=0 TSval=1119937262 TSecr=2865833092
182	0.000000013	192.168.119.1	192.168.119.133	TCP	7890,40824		52	7890 → 40824 [ACK] Seq=1104 Ack=36764 Win=4100 Len=0 TSval=1119937262 TSecr=2865833092
183	0.002283959	192.168.119.1	192.168.119.133	TLSv1.2	7890,40824		94	Application Data
184	0.033143089	192.168.119.1	192.168.119.133	TLSv1.2	7890,40824		409	Application Data
185	0.000000252	192.168.119.1	192.168.119.133	TLSv1.2	7890,40824		90	Application Data
186	0.000033559	192.168.119.133	192.168.119.1	TCP	40824,7890		52	40824 → 7890 [ACK] Seq=36764 Ack=1503 Win=2967 Len=0 TSval=2865833128 TSecr=1119937265
187	0.042535190	192.168.119.133	192.168.119.1	TCP	40824,7890		52	40824 → 7890 [ACK] Seq=36764 Ack=1541 Win=2967 Len=0 TSval=2865833170 TSecr=1119937298
188	0.134476348	192.168.119.133	192.168.119.1	AMS	48898,7890		82	
189	0.000170281	192.168.119.133	192.168.119.1	AMS	48898,7890		2861	
190	0.000104879	192.168.119.1	192.168.119.133	TCP	7890,48898		52	7890 → 48898 [ACK] Seq=51 Ack=1537 Win=4100 Len=0 TSval=1119937475 TSecr=2865833305
191	0.029418881	192.168.119.1	192.168.119.133	TCP	7890,36420		41	[TCP Keep-Alive] 7890 → 36420 [ACK] Seq=1 Ack=1 Win=4100 Len=1
192	0.000019406	192.168.119.133	192.168.119.1	TCP	36420,7890		64	[TCP Keep-Alive ACK] 36420 → 7890 [ACK] Seq=1 Ack=2 Win=501 Len=0 TSval=2865833335 TSecr=1119712412 SLE=1 SRE=2
193	0.016009248	192.168.119.1	192.168.119.133	TCP	7890,48898		52	7890 → 48898 [ACK] Seq=51 Ack=2898 Win=4095 Len=0 TSval=1119937520 TSecr=2865833305
194	0.001212530	192.168.119.1	192.168.119.133	AMS	7890,48898		2094	
195	0.000012084	192.168.119.133	192.168.119.1	TCP	48898,7890		52	48898 → 7890 [ACK] Seq=2898 Ack=2093 Win=496 Len=0 TSval=2865833352 TSecr=1119937522
196	0.556461531	192.168.119.133	192.168.119.1	TLSv1.2	44316,7890		2582	Application Data
197	0.000163185	192.168.119.1	192.168.119.133	TCP	7890,44316		52	7890 → 44316 [ACK] Seq=3328 Ack=10606 Win=4100 Len=0 TSval=1119938078 TSecr=2865833908
198	0.102290315	192.168.119.1	192.168.119.133	TLSv1.2	7890,44316		865	Application Data
199	0.000000456	192.168.119.1	192.168.119.133	TLSv1.2	7890,44316		83	Application Data
200	0.000049428	192.168.119.133	192.168.119.1	TCP	44316,7890		52	44316 → 7890 [ACK] Seq=10606 Ack=4141 Win=1309 Len=0 TSval=2865834011 TSecr=1119938180
201	0.000111650	192.168.119.133	192.168.119.1	TCP	44316,7890		52	44316 → 7890 [ACK] Seq=10606 Ack=4172 Win=1309 Len=0 TSval=2865834011 TSecr=1119938180
202	1.017039072	192.168.119.1	192.168.119.133	TCP	7890,33076		41	[TCP Keep-Alive] 7890 → 33076 [ACK] Seq=1 Ack=1 Win=4100 Len=1
203	0.000017016	192.168.119.133	192.168.119.1	TCP	33076,7890		64	[TCP Keep-Alive ACK] 33076 → 7890 [ACK] Seq=1 Ack=2 Win=501 Len=0 TSval=2865835028 TSecr=1119894218 SLE=1 SRE=2
204	1.017100104	192.168.119.133	192.168.119.1	TLSv1.2	44316,7890		2582	Application Data
205	0.000163569	192.168.119.1	192.168.119.133	TCP	7890,44316		52	7890 → 44316 [ACK] Seq=4172 Ack=13136 Win=4100 Len=0 TSval=1119940214 TSecr=2865836045
206	0.000049765	192.168.119.133	192.168.119.1	TLSv1.2	44316,7890		132	Application Data
207	0.008102219	192.168.119.133	192.168.119.1	TLSv1.2	44316,7890		2587	Application Data
208	0.000200545	192.168.119.1	192.168.119.133	TCP	7890,44316		52	7890 → 44316 [ACK] Seq=4172 Ack=14664 Win=4100 Len=0 TSval=1119940222 TSecr=2865836045
209	0.000060025	192.168.119.133	192.168.119.1	TLSv1.2	44316,7890		204	Application Data
210	0.000094431	192.168.119.1	192.168.119.133	TCP	7890,44316		52	7890 → 44316 [ACK] Seq=4172 Ack=15903 Win=4095 Len=0 TSval=1119940222 TSecr=2865836053
211	0.012241110	192.168.119.133	192.168.119.1	TLSv1.2	44316,7890		2608	Application Data
212	0.000165829	192.168.119.1	192.168.119.133	TCP	7890,44316		52	7890 → 44316 [ACK] Seq=4172 Ack=18459 Win=4100 Len=0 TSval=1119940235 TSecr=2865836066
213	0.000085904	192.168.119.133	192.168.119.1	TLSv1.2	44316,7890		83	Application Data
214	0.027382358	192.168.119.1	192.168.119.133	TLSv1.2	7890,44316		853	Application Data
215	0.000000206	192.168.119.1	192.168.119.133	TLSv1.2	7890,44316		83	Application Data
216	0.000022684	192.168.119.133	192.168.119.1	TCP	44316,7890		52	44316 → 7890 [ACK] Seq=18490 Ack=4973 Win=1309 Len=0 TSval=2865836094 TSecr=1119940262
217	0.000037727	192.168.119.133	192.168.119.1	TCP	44316,7890		52	44316 → 7890 [ACK] Seq=18490 Ack=5004 Win=1309 Len=0 TSval=2865836094 TSecr=1119940262
218	0.012149080	192.168.119.1	192.168.119.133	TLSv1.2	7890,44316		759	Application Data
219	0.000000226	192.168.119.1	192.168.119.133	TLSv1.2	7890,44316		83	Application Data
220	0.000013252	192.168.119.133	192.168.119.1	TCP	44316,7890		52	44316 → 7890 [ACK] Seq=18490 Ack=5711 Win=1309 Len=0 TSval=2865836106 TSecr=1119940274
221	0.000034527	192.168.119.133	192.168.119.1	TCP	44316,7890		52	44316 → 7890 [ACK] Seq=18490 Ack=5742 Win=1309 Len=0 TSval=2865836106 TSecr=1119940274
222	0.003918345	192.168.119.1	192.168.119.133	TLSv1.2	7890,44316		775	Application Data
223	0.000000045	192.168.119.1	192.168.119.133	TLSv1.2	7890,44316		83	Application Data
224	0.000007540	192.168.119.133	192.168.119.1	TCP	44316,7890		52	44316 → 7890 [ACK] Seq=18490 Ack=6465 Win=1309 Len=0 TSval=2865836110 TSecr=1119940278
225	0.000028697	192.168.119.133	192.168.119.1	TCP	44316,7890		52	44316 → 7890 [ACK] Seq=18490 Ack=6496 Win=1309 Len=0 TSval=2865836110 TSecr=1119940278
226	0.412486617	192.168.119.133	192.168.119.1	TCP	53900,7890		52	[TCP Keep-Alive] 53900 → 7890 [ACK] Seq=0 Ack=2 Win=501 Len=0 TSval=2865836522 TSecr=1119925807
227	0.000122788	192.168.119.1	192.168.119.133	TCP	7890,53900		52	[TCP Keep-Alive ACK] 7890 → 53900 [ACK] Seq=2 Ack=1 Win=4097 Len=0 TSval=1119940691 TSecr=2865826509
228	0.502203291	192.168.119.133	192.168.119.1	AMS	48898,7890		82	
229	0.000157389	192.168.119.133	192.168.119.1	AMS	48898,7890		2835	AMS Response
230	0.000127198	192.168.119.1	192.168.119.133	TCP	7890,48898		52	7890 → 48898 [ACK] Seq=2093 Ack=4376 Win=4100 Len=0 TSval=1119941193 TSecr=2865837025
231	0.040909735	192.168.119.1	192.168.119.133	AMS	7890,48898		2047	AMS Response
232	0.000025091	192.168.119.133	192.168.119.1	TCP	48898,7890		52	48898 → 7890 [ACK] Seq=5711 Ack=4088 Win=496 Len=0 TSval=2865837066 TSecr=1119941233
233	0.224500238	192.168.119.133	192.168.119.1	TCP	53876,7890		52	[TCP Keep-Alive] 53876 → 7890 [ACK] Seq=0 Ack=2 Win=501 Len=0 TSval=2865837290 TSecr=1119926319
234	0.000135667	192.168.119.1	192.168.119.133	TCP	7890,53876		52	[TCP Keep-Alive ACK] 7890 → 53876 [ACK] Seq=2 Ack=1 Win=4100 Len=0 TSval=1119941458 TSecr=2865827069
235	4.219115615	192.168.119.1	192.168.119.133	TCP	7890,53900		41	[TCP Keep-Alive] 7890 → 53900 [ACK] Seq=1 Ack=1 Win=4097 Len=1
236	0.000047488	192.168.119.133	192.168.119.1	TCP	53900,7890		64	[TCP Keep-Alive ACK] 53900 → 7890 [ACK] Seq=1 Ack=2 Win=501 Len=0 TSval=2865841510 TSecr=1119940691 SLE=1 SRE=2
237	0.281843015	192.168.119.133	192.168.119.1	TLSv1.2	40914,7890		81	Application Data
238	0.003996450	192.168.119.1	192.168.119.133	TLSv1.2	7890,40914		77	Application Data
239	0.000017880	192.168.119.133	192.168.119.1	TCP	40914,7890		52	40914 → 7890 [ACK] Seq=88 Ack=76 Win=501 Len=0 TSval=2865841795 TSecr=1119945956
240	0.277108472	192.168.119.1	192.168.119.133	TCP	7890,53876		41	[TCP Keep-Alive] 7890 → 53876 [ACK] Seq=1 Ack=1 Win=4100 Len=1
241	0.000028372	192.168.119.133	192.168.119.1	TCP	53876,7890		64	[TCP Keep-Alive ACK] 53876 → 7890 [ACK] Seq=1 Ack=2 Win=501 Len=0 TSval=2865842073 TSecr=1119941458 SLE=1 SRE=2
242	1.746995018	192.168.119.1	192.168.119.133	TCP	7890,42890		41	[TCP Keep-Alive] 7890 → 42890 [ACK] Seq=262006 Ack=1389 Win=1048320 Len=1
243	0.000020352	192.168.119.133	192.168.119.1	TCP	42890,7890		64	[TCP Keep-Alive ACK] 42890 → 7890 [ACK] Seq=1389 Ack=262007 Win=320640 Len=0 TSval=2865843820 TSecr=1119917951 SLE=262006 SRE=262007
244	0.019378756	192.168.119.133	192.168.119.1	TLSv1.2	44316,7890		2516	Application Data
245	0.000201719	192.168.119.1	192.168.119.133	TCP	7890,44316		52	7890 → 44316 [ACK] Seq=6496 Ack=20954 Win=4100 Len=0 TSval=1119947996 TSecr=2865843839
246	0.006791559	192.168.119.133	192.168.119.1	TLSv1.2	44316,7890		2587	Application Data
247	0.000173715	192.168.119.1	192.168.119.133	TCP	7890,44316		52	7890 → 44316 [ACK] Seq=6496 Ack=23489 Win=4100 Len=0 TSval=1119948003 TSecr=2865843846
248	0.000061677	192.168.119.133	192.168.119.1	TLSv1.2	44316,7890		204	Application Data
249	0.011544041	192.168.119.133	192.168.119.1	TLSv1.2	44316,7890		2585	Application Data
250	0.000178539	192.168.119.1	192.168.119.133	TCP	7890,44316		52	7890 → 44316 [ACK] Seq=6496 Ack=25089 Win=4100 Len=0 TSval=1119948014 TSecr=2865843846
251	0.003292459	192.168.119.133	192.168.119.1	AMS	48898,7890		82	
252	0.000117396	192.168.119.133	192.168.119.1	AMS	48898,7890		2835	
253	0.000102693	192.168.119.1	192.168.119.133	TCP	7890,48898		52	7890 → 48898 [ACK] Seq=4088 Ack=7189 Win=4100 Len=0 TSval=1119948018 TSecr=2865843861
254	0.010385105	192.168.119.133	192.168.119.1	TLSv1.2	44316,7890		2521	Application Data
255	0.000381326	192.168.119.1	192.168.119.133	TCP	7890,44316		52	7890 → 44316 [ACK] Seq=6496 Ack=27622 Win=4100 Len=0 TSval=1119948028 TSecr=2865843858
256	0.004871578	192.168.119.133	192.168.119.1	TLSv1.2	44316,7890		2393	Application Data
257	0.000149640	192.168.119.1	192.168.119.133	TCP	7890,44316		52	7890 → 44316 [ACK] Seq=6496 Ack=30091 Win=4100 Len=0 TSval=1119948034 TSecr=2865843872
258	0.023218374	192.168.119.1	192.168.119.133	TLSv1.2	7890,44316		875	Application Data
259	0.000000173	192.168.119.1	192.168.119.133	TLSv1.2	7890,44316		83	Application Data
260	0.000025448	192.168.119.133	192.168.119.1	TCP	44316,7890		52	44316 → 7890 [ACK] Seq=30984 Ack=7319 Win=1309 Len=0 TSval=2865843901 TSecr=1119948057
261	0.000034098	192.168.119.133	192.168.119.1	TCP	44316,7890		52	44316 → 7890 [ACK] Seq=30984 Ack=7350 Win=1309 Len=0 TSval=2865843901 TSecr=1119948057
262	0.002338791	192.168.119.1	192.168.119.133	AMS	7890,48898		2047	
263	0.000011880	192.168.119.133	192.168.119.1	TCP	48898,7890		52	48898 → 7890 [ACK] Seq=8524 Ack=6083 Win=496 Len=0 TSval=2865843903 TSecr=1119948059
264	0.006485304	192.168.119.1	192.168.119.133	TLSv1.2	7890,44316		722	Application Data
265	0.000000213	192.168.119.1	192.168.119.133	TLSv1.2	7890,44316		83	Application Data
266	0.000017093	192.168.119.133	192.168.119.1	TCP	44316,7890		52	44316 → 7890 [ACK] Seq=30984 Ack=8020 Win=1309 Len=0 TSval=2865843909 TSecr=1119948066
267	0.000038314	192.168.119.133	192.168.119.1	TCP	44316,7890		52	44316 → 7890 [ACK] Seq=30984 Ack=8051 Win=1309 Len=0 TSval=2865843909 TSecr=1119948066
268	0.008395479	192.168.119.1	192.168.119.133	TLSv1.2	7890,44316		722	Application Data
269	0.000000145	192.168.119.1	192.168.119.133	TLSv1.2	7890,44316		83	Application Data
270	0.000016059	192.168.119.133	192.168.119.1	TCP	44316,7890		52	44316 → 7890 [ACK] Seq=30984 Ack=8721 Win=1309 Len=0 TSval=2865843918 TSecr=1119948074
271	0.000037436	192.168.119.133	192.168.119.1	TCP	44316,7890		52	44316 → 7890 [ACK] Seq=30984 Ack=8752 Win=1309 Len=0 TSval=2865843918 TSecr=1119948074
272	0.015408135	192.168.119.1	192.168.119.133	TLSv1.2	7890,44316		802	Application Data
273	0.000000110	192.168.119.1	192.168.119.133	TLSv1.2	7890,44316		83	Application Data
274	0.000012265	192.168.119.133	192.168.119.1	TCP	44316,7890		52	44316 → 7890 [ACK] Seq=30984 Ack=9502 Win=1309 Len=0 TSval=2865843933 TSecr=1119948090
275	0.000034053	192.168.119.133	192.168.119.1	TCP	44316,7890		52	44316 → 7890 [ACK] Seq=30984 Ack=9533 Win=1309 Len=0 TSval=2865843933 TSecr=1119948090
276	0.012661968	192.168.119.133	192.168.119.1	TLSv1.2	44316,7890		2598	Application Data
277	0.000170903	192.168.119.1	192.168.119.133	TCP	7890,44316		52	7890 → 44316 [ACK] Seq=9533 Ack=33530 Win=4100 Len=0 TSval=1119948103 TSecr=2865843946
278	0.000071746	192.168.119.133	192.168.119.1	TLSv1.2	44316,7890		83	Application Data
279	0.004671868	192.168.119.1	192.168.119.133	TLSv1.2	7890,44316		1202	Application Data
280	0.000000043	192.168.119.1	192.168.119.133	TLSv1.2	7890,44316		83	Application Data
281	0.000123726	192.168.119.133	192.168.119.1	TCP	44316,7890		52	44316 → 7890 [ACK] Seq=33561 Ack=10714 Win=1309 Len=0 TSval=2865843951 TSecr=1119948107
282	0.088249348	192.168.119.133	192.168.119.1	TLSv1.2	40824,7890		131	Application Data
283	0.028499601	192.168.119.1	192.168.119.133	TLSv1.2	7890,40824		397	Application Data
284	0.000020473	192.168.119.133	192.168.119.1	TCP	40824,7890		52	40824 → 7890 [ACK] Seq=36843 Ack=1886 Win=2990 Len=0 TSval=2865844068 TSecr=1119948224
285	0.000825766	192.168.119.133	192.168.119.1	TLSv1.2	40824,7890		137	Application Data
286	0.000117840	192.168.119.133	192.168.119.1	TLSv1.2	40824,7890		1670	Application Data
287	0.000119381	192.168.119.1	192.168.119.133	TCP	7890,40824		52	7890 → 40824 [ACK] Seq=1886 Ack=38376 Win=4100 Len=0 TSval=1119948225 TSecr=2865844069
288	0.000063416	192.168.119.133	192.168.119.1	TCP	40824,7890		7292	[TCP segment of a reassembled PDU]
289	0.000108307	192.168.119.1	192.168.119.133	TCP	7890,40824		52	7890 → 40824 [ACK] Seq=1886 Ack=39994 Win=4100 Len=0 TSval=1119948225 TSecr=2865844069
290	0.000000041	192.168.119.1	192.168.119.133	TCP	7890,40824		52	7890 → 40824 [ACK] Seq=1886 Ack=42890 Win=4100 Len=0 TSval=1119948225 TSecr=2865844069
291	0.000000014	192.168.119.1	192.168.119.133	TCP	7890,40824		52	7890 → 40824 [ACK] Seq=1886 Ack=45786 Win=4100 Len=0 TSval=1119948225 TSecr=2865844069
292	0.000017515	192.168.119.133	192.168.119.1	TCP	40824,7890		5844	40824 → 7890 [PSH, ACK] Seq=45786 Ack=1886 Win=2990 Len=5792 TSval=2865844069 TSecr=1119948225 [TCP segment of a reassembled PDU]
293	0.000097210	192.168.119.1	192.168.119.133	TCP	7890,40824		52	7890 → 40824 [ACK] Seq=1886 Ack=48682 Win=4100 Len=0 TSval=1119948225 TSecr=2865844069
294	0.000000035	192.168.119.1	192.168.119.133	TCP	7890,40824		52	7890 → 40824 [ACK] Seq=1886 Ack=51578 Win=4100 Len=0 TSval=1119948225 TSecr=2865844069
295	0.000016344	192.168.119.133	192.168.119.1	TLSv1.2	40824,7890		3058	Application Data
296	0.000081357	192.168.119.1	192.168.119.133	TCP	7890,40824		52	7890 → 40824 [ACK] Seq=1886 Ack=54474 Win=4100 Len=0 TSval=1119948225 TSecr=2865844069
297	0.000040752	192.168.119.133	192.168.119.1	TCP	40824,7890		14532	[TCP segment of a reassembled PDU]
298	0.000190830	192.168.119.1	192.168.119.133	TCP	7890,40824		52	7890 → 40824 [ACK] Seq=1886 Ack=56032 Win=4100 Len=0 TSval=1119948225 TSecr=2865844069
299	0.000000053	192.168.119.1	192.168.119.133	TCP	7890,40824		52	7890 → 40824 [ACK] Seq=1886 Ack=58928 Win=4100 Len=0 TSval=1119948226 TSecr=2865844069
300	0.000000016	192.168.119.1	192.168.119.133	TCP	7890,40824		52	7890 → 40824 [ACK] Seq=1886 Ack=61824 Win=4100 Len=0 TSval=1119948226 TSecr=2865844069
301	0.000000017	192.168.119.1	192.168.119.133	TCP	7890,40824		52	7890 → 40824 [ACK] Seq=1886 Ack=64720 Win=4100 Len=0 TSval=1119948226 TSecr=2865844069
302	0.000000013	192.168.119.1	192.168.119.133	TCP	7890,40824		52	7890 → 40824 [ACK] Seq=1886 Ack=67616 Win=4100 Len=0 TSval=1119948226 TSecr=2865844069
303	0.000016383	192.168.119.133	192.168.119.1	TLSv1.2	40824,7890		330	Application Data
304	0.000079138	192.168.119.1	192.168.119.133	TCP	7890,40824		52	7890 → 40824 [ACK] Seq=1886 Ack=69342 Win=4100 Len=0 TSval=1119948226 TSecr=2865844069
305	0.000028140	192.168.119.133	192.168.119.1	TLSv1.2	40824,7890		1386	Application Data
306	0.000091078	192.168.119.133	192.168.119.1	TLSv1.2	40824,7890		3664	Application Data
307	0.000086988	192.168.119.1	192.168.119.133	TCP	7890,40824		52	7890 → 40824 [ACK] Seq=1886 Ack=72124 Win=4100 Len=0 TSval=1119948226 TSecr=2865844070
308	0.000000039	192.168.119.1	192.168.119.133	TCP	7890,40824		52	7890 → 40824 [ACK] Seq=1886 Ack=74288 Win=4100 Len=0 TSval=1119948226 TSecr=2865844070
309	0.024528487	192.168.119.1	192.168.119.133	TLSv1.2	7890,44316		925	Application Data
310	0.000000220	192.168.119.1	192.168.119.133	TLSv1.2	7890,44316		83	Application Data
311	0.000197257	192.168.119.133	192.168.119.1	TCP	44316,7890		52	44316 → 7890 [ACK] Seq=33561 Ack=11618 Win=1309 Len=0 TSval=2865844095 TSecr=1119948250
312	0.001630316	192.168.119.1	192.168.119.133	TLSv1.2	7890,40824		353	Application Data
313	0.000000060	192.168.119.1	192.168.119.133	TLSv1.2	7890,40824		90	Application Data
314	0.000116803	192.168.119.133	192.168.119.1	TCP	40824,7890		52	40824 → 7890 [ACK] Seq=74288 Ack=2225 Win=3013 Len=0 TSval=2865844096 TSecr=1119948252
315	0.669009100	192.168.119.133	192.168.119.1	TCP	38236,7890		60	38236 → 7890 [SYN] Seq=0 Win=64240 Len=0 MSS=1460 SACK_PERM=1 TSval=2865844765 TSecr=0 WS=128
316	0.000178633	192.168.119.1	192.168.119.133	TCP	7890,38236		60	7890 → 38236 [SYN, ACK] Seq=0 Ack=1 Win=65535 Len=0 MSS=1460 WS=256 SACK_PERM=1 TSval=1119948920 TSecr=2865844765
317	0.000025781	192.168.119.133	192.168.119.1	TCP	38236,7890		52	38236 → 7890 [ACK] Seq=1 Ack=1 Win=64256 Len=0 TSval=2865844765 TSecr=1119948920
318	0.000198038	192.168.119.133	192.168.119.1	HTTP	38236,7890		267	CONNECT mon.zijieapi.com:443 HTTP/1.1 
319	0.000224355	192.168.119.1	192.168.119.133	HTTP	7890,38236		91	HTTP/1.1 200 Connection established 
